"Surrogate-Assisted Robust Optimization of Large-Scale Networks Based on Graph Embedding","S. Wang; J. Liu; Y. Jin","School of Artificial Intelligence, Xidian University, Xi’an, China; School of Artificial Intelligence, Xidian University, Xi’an, China; Department of Computer Science, University of Surrey, Guildford, U.K.","IEEE Transactions on Evolutionary Computation","29 Jul 2020","2020","24","4","735","749","Robust optimization of complex networks has attracted much attention in recent years. Although existing methods have been successful in achieving promising results, the computational cost for robust optimization tasks is extremely high, which prevents them from being further applied to large-scale networks. Thus, computationally efficient robust optimization methods are in high demand. This article proposes a low-cost method for estimating the robustness of networks with the help of graph embedding techniques and surrogate models. An evolutionary algorithm is then developed to find large-scale robust networks by combining the surrogate-assisted low-cost robustness estimator with the time-consuming real robustness measure by means of a model management strategy. The experimental results on different kinds of synthetic and real networks demonstrate the highly competitive search ability of the proposed algorithm. In addition, the algorithm is able to save up to 80% of the computation time for enhancing the robustness of large-scale networks compared with the state-of-the-art methods.","1941-0026","","10.1109/TEVC.2019.2950935","General Program of National Natural Science Foundation of China(grant numbers:61773300); Key Program of Fundamental Research Project of Natural Science of Shaanxi Province, China(grant numbers:2017JZ017); Royal Society(grant numbers:IEC\NSFC\170279); ","https://ieeexplore.ieee.org/stamp/stamp.jsp?arnumber=8889655","Complex networks;evolutionary algorithm (EA);graph embedding (GE);robustness;surrogate-assisted optimization","Robustness;Computational modeling;Germanium;Computational efficiency;Optimization methods;Task analysis","complex networks;computational complexity;evolutionary computation;graph theory;optimisation","surrogate-assisted robust optimization;large-scale networks;complex networks;computational cost;robust optimization tasks;computationally efficient robust optimization methods;graph embedding techniques;surrogate models;large-scale robust networks;low-cost robustness estimator;robustness measure;highly competitive search ability;computation time","","27","","49","IEEE","1 Nov 2019","","","IEEE","IEEE Journals"
"Novel Interactive Preference-Based Multiobjective Evolutionary Optimization for Bolt Supporting Networks","Y. -N. Guo; X. Zhang; D. -W. Gong; Z. Zhang; J. -J. Yang","School of Information and Control Engineering, China University of Mining and Technology, Xuzhou, China; Dongfang Electronics Company, Ltd., Yantai, China; School of Information and Control Engineering, China University of Mining and Technology, Xuzhou, China; School of Information and Control Engineering, China University of Mining and Technology, Xuzhou, China; School of Mechanical Electronic and Information Engineering, China University of Mining and Technology at Beijing, Beijing, China","IEEE Transactions on Evolutionary Computation","29 Jul 2020","2020","24","4","750","764","Previous methods of designing a bolt supporting network, which depend on engineering experiences, seek optimal bolt supporting schemes in terms of supporting quality. The supporting cost and time, however, have not been considered, which restricts their applications in real-world situations. We formulate the problem of designing a bolt supporting network as a three-objective optimization model by simultaneously considering such indicators as quality, economy, and efficiency. Especially, two surrogate models are constructed by support vector regression for roof-to-floor convergence and the two-sided displacement, respectively, so as to rapidly evaluate supporting quality during optimization. To solve the formulated model, a novel interactive preference-based multiobjective evolutionary algorithm is proposed. The highlight of generic methods which interactively articulate preferences is to systematically manage the regions of interest by three steps, that is, “partitioning-updating-tracking” in accordance with the cognition process of human. The preference regions of a decision-maker (DM) are first articulated and employed to narrow down the feasible objective space before the evolution in terms of nadir point, not the commonly used ideal point. Then, the DM’s preferences are tracked by dynamically updating these preference regions based on satisfactory candidates during the evolution. Finally, individuals in the population are evaluated based on the preference regions. We apply the proposed model and algorithm to design the bolt supporting network of a practical roadway. The experimental results show that the proposed method can generate an optimal bolt supporting scheme with a good balance between supporting quality and the other demands, besides speeding up its convergence.","1941-0026","","10.1109/TEVC.2019.2951217","National Natural Science Foundation of China(grant numbers:61973305,61573361,61773384); Six Talent Peaks Project in Jiangsu Province(grant numbers:2017-DZXX-046); State Key Laboratory of Robotics, China(grant numbers:2019-O12); National Basic Research Program of China (973 Program)(grant numbers:2018YFB1003802-01); ","https://ieeexplore.ieee.org/stamp/stamp.jsp?arnumber=8890620","Bolt supporting network;interaction;multiobjective evolutionary optimization;preference;surrogate model","Fasteners;Optimization;Rocks;Stability analysis;Tunneling","civil engineering computing;costing;decision making;design engineering;economics;evolutionary computation;fasteners;floors;optimisation;quality control;regression analysis;roads;roofs;support vector machines;supports","multiobjective evolutionary optimization;supporting quality;supporting cost;support vector regression;bolt supporting networks design;economy;roof-to-floor convergence;cognition process;decision-maker;roadway","","89","","49","IEEE","4 Nov 2019","","","IEEE","IEEE Journals"
"MUMI: Multitask Module Identification for Biological Networks","W. Chen; Z. Zhu; S. He","School of Computer Science, University of Birmingham, Birmingham, U.K.; College of Computer Science and Software Engineering, Shenzhen University, Shenzhen, China; School of Computer Science, University of Birmingham, Birmingham, U.K.","IEEE Transactions on Evolutionary Computation","29 Jul 2020","2020","24","4","765","776","Identifying modules from biological networks is important since modules reveal essential mechanisms and dynamic processes in biological systems. Existing algorithms focus on identifying either active modules or topological modules (communities), which represent dynamic and topological units in the network, respectively. However, high-level biological phenomena, e.g., functions are emergent properties from the interplay between network topology and dynamics. Therefore, to fully explain the mechanisms underlying the high-level biological phenomena, it is important to identify the overlaps between communities and active modules, which indicate the topological units with significant changes of dynamics. However, despite the importance, there are no existing methods to do so. In this article, we propose the multitask module identification (MUMI) algorithm to detect the overlaps between active modules and communities simultaneously. The experimental results show that our method provides new insights into biological mechanisms by combining information from active modules and communities. By formulating the problem as a multitasking learning problem which searches for these two types of modules simultaneously, the algorithm can exploit their latent complementarities to obtain better search performance in terms of accuracy and convergence. Our MATLAB implementation of MUMI is available at https://github.com/WeiqiChen/Mumi-multitask-module-identification.","1941-0026","","10.1109/TEVC.2019.2952220","National Natural Science Foundation of China(grant numbers:61871272); Shenzhen Scientific Research and Development Funding Program(grant numbers:JCYJ20170302154328155); ","https://ieeexplore.ieee.org/stamp/stamp.jsp?arnumber=8894074","Active module;community detection;multifactorial evolution","Task analysis;Optimization;Multitasking;Search problems;Evolution (biology);Evolutionary computation","biology computing;learning (artificial intelligence)","biological networks;dynamic processes;biological systems;active modules;topological modules;topological units;network topology;high-level biological phenomena;multitask module identification algorithm;biological mechanisms;MUMI","","11","","42","IEEE","7 Nov 2019","","","IEEE","IEEE Journals"
"Paradoxes in Numerical Comparison of Optimization Algorithms","Q. Liu; W. V. Gehrlein; L. Wang; Y. Yan; Y. Cao; W. Chen; Y. Li","Dongguan Industry 4.0 Artificial Intelligence Laboratory, Dongguan University of Technology, Dongguan, China; Department of Business Administration, University of Delaware, Newark, USA; Department of Automation, Tsinghua University, Beijing, China; Dongguan Industry 4.0 Artificial Intelligence Laboratory, Dongguan University of Technology, Dongguan, China; Dongguan Industry 4.0 Artificial Intelligence Laboratory, Dongguan University of Technology, Dongguan, China; Dongguan Industry 4.0 Artificial Intelligence Laboratory, Dongguan University of Technology, Dongguan, China; Dongguan Industry 4.0 Artificial Intelligence Laboratory, Dongguan University of Technology, Dongguan, China","IEEE Transactions on Evolutionary Computation","29 Jul 2020","2020","24","4","777","791","Numerical comparison is often key to verifying the performance of optimization algorithms, especially, global optimization algorithms. However, studies have so far neglected issues concerning comparison strategies necessary to rank optimization algorithms properly. To fill this gap for the first time, we combine voting theory and numerical comparison research areas, which have been disjoint so far, and thus extend the results of the former to the latter for optimization algorithms. In particular, we investigate compatibility issues arising from comparing two and more than two algorithms, termed “C2” and “C2+” in this article, respectively. Through defining and modeling “C2” and “C2+” mathematically, it is uncovered and illustrated that numerical comparison can be incompatible. Further, two possible paradoxes, namely, “cycle ranking” and “survival of the nonfittest,” are discovered and analyzed rigorously. The occurrence probabilities of these two paradoxes are also calculated under the no-free-lunch assumption, which shows the first justifiable use of the impartial culture assumption from voting theory, providing a point of reference to the frequency of the paradoxes occurring. It is also shown that significant influence on these probabilities comes from the number of algorithms and the number of optimization problems studied in the comparison. Further, various limiting probabilities when the number of optimization problems goes to infinity are also derived and characterized. The results would help guide benchmarking and developing optimization and machine learning algorithms.","1941-0026","","10.1109/TEVC.2019.2955110","National Basic Research Program of China (973 Program)(grant numbers:2016YFD0400206); National Natural Science Fund for Distinguished Young Scholars of China(grant numbers:61525304); National Natural Science Foundation of China(grant numbers:61773119,61873328); Dongguan University of Technology(grant numbers:KCYKYQD2017014,DGUT(Q)-GGB-2016005); ","https://ieeexplore.ieee.org/stamp/stamp.jsp?arnumber=8910400","Cycle ranking;evolutionary computation;machine learning;numerical comparison;optimization","Optimization;Benchmark testing;Mathematical model;Numerical models;Machine learning algorithms;Measurement;Convergence","optimisation","optimization algorithms;numerical comparison","","8","","48","CCBY","22 Nov 2019","","","IEEE","IEEE Journals"
"A Novel Evolutionary Algorithm for Dynamic Constrained Multiobjective Optimization Problems","Q. Chen; J. Ding; S. Yang; T. Chai","State Key Laboratory of Synthetical Automation for Process Industries, Northeastern University, Shenyang, China; State Key Laboratory of Synthetical Automation for Process Industries, Northeastern University, Shenyang, China; State Key Laboratory of Synthetical Automation for Process Industries, Northeastern University, Shenyang, China; State Key Laboratory of Synthetical Automation for Process Industries, Northeastern University, Shenyang, China","IEEE Transactions on Evolutionary Computation","29 Jul 2020","2020","24","4","792","806","To promote research on dynamic constrained multiobjective optimization, we first propose a group of generic test problems with challenging characteristics, including different modes of the true Pareto front (e.g., convexity-concavity and connectedness-disconnectedness) and the changing feasible region. Subsequently, motivated by the challenges presented by dynamism and constraints, we design a dynamic constrained multiobjective optimization algorithm with a nondominated solution selection operator, a mating selection strategy, a population selection operator, a change detection method, and a change response strategy. The designed nondominated solution selection operator can obtain a nondominated population with diversity when the environment changes. The mating selection strategy and population selection operator can adaptively handle infeasible solutions. If a change is detected, the proposed change response strategy reuses some portion of the old solutions in combination with randomly generated solutions to reinitialize the population, and a steady-state update method is designed to improve the retained previous solutions. The experimental results show that the proposed test problems can be used to clearly distinguish the performance of algorithms, and that the proposed algorithm is very competitive for solving dynamic constrained multiobjective optimization problems in comparison with state-of-the-art algorithms.","1941-0026","","10.1109/TEVC.2019.2958075","National Natural Science Foundation of China(grant numbers:61988101,61525302,61590922,61673331); National Basic Research Program of China (973 Program)(grant numbers:2018YFB1701104); Xingliao Plan of Liaoning Province(grant numbers:XLYC1808001); ","https://ieeexplore.ieee.org/stamp/stamp.jsp?arnumber=8926382","Change response;dynamic constrained multiobjective optimization;population selection;test problems","Optical fibers;Sociology;Statistics;Heuristic algorithms;Linear programming;Optimization;Convergence","genetic algorithms;Pareto optimisation","change response strategy;evolutionary algorithm;generic test problems;dynamic constrained multiobjective optimization algorithm;mating selection strategy;population selection operator;change detection method;nondominated solution selection operator","","45","","64","IEEE","6 Dec 2019","","","IEEE","IEEE Journals"
"Erratum to “R2-Based Hypervolume Contribution Approximation” [Feb 20 185-192]","K. Shang; H. Ishibuchi; X. Ni","Department of Computer Science and Engineering, Shenzhen Key Laboratory of Computational Intelligence, University Key Laboratory of Evolving Intelligent Systems of Guangdong Province, Southern University of Science and Technology, Shenzhen, China; Department of Computer Science and Engineering, Shenzhen Key Laboratory of Computational Intelligence, University Key Laboratory of Evolving Intelligent Systems of Guangdong Province, Southern University of Science and Technology, Shenzhen, China; Department of Computer Science and Engineering, Shenzhen Key Laboratory of Computational Intelligence, University Key Laboratory of Evolving Intelligent Systems of Guangdong Province, Southern University of Science and Technology, Shenzhen, China","IEEE Transactions on Evolutionary Computation","29 Jul 2020","2020","24","4","807","807","In [1], the authors’ names appeared incorrectly on the Table of Contents. They should have appeared as follows:","1941-0026","","10.1109/TEVC.2020.3007272","","https://ieeexplore.ieee.org/stamp/stamp.jsp?arnumber=9152194","","Monte Carlo methods;Approximation methods;Sampling methods","","","","","","1","IEEE","29 Jul 2020","","","IEEE","IEEE Journals"
"Introducing IEEE Collabratec","",,"IEEE Transactions on Evolutionary Computation","29 Jul 2020","2020","24","4","808","808","Advertisement, IEEE. IEEE Collabratec is a new, integrated online community where IEEE members, researchers, authors, and technology professionals with similar fields of interest can network and collaborate, as well as create and manage content. Featuring a suite of powerful online networking and collaboration tools, IEEE Collabratec allows you to connect according to geographic location, technical interests, or career pursuits. You can also create and share a professional identity that showcases key accomplishments and participate in groups focused around mutual interests, actively learning from and contributing to knowledgeable communities. All in one place! Learn about IEEE Collabratec at ieeecollabratec.org.","1941-0026","","10.1109/TEVC.2020.3009802","","https://ieeexplore.ieee.org/stamp/stamp.jsp?arnumber=9152181","","","","","","","","","IEEE","29 Jul 2020","","","IEEE","IEEE Journals"
"IEEE Transactions on Evolutionary Computation Society Information","",,"IEEE Transactions on Evolutionary Computation","29 Jul 2020","2020","24","4","C3","C3","Presents a listing of the editorial board, board of governors, current staff, committee members, and/or society editors for this issue of the publication.","1941-0026","","10.1109/TEVC.2020.3008740","","https://ieeexplore.ieee.org/stamp/stamp.jsp?arnumber=9152180","","","","","","","","","IEEE","29 Jul 2020","","","IEEE","IEEE Journals"
"IEEE Transactions on Evolutionary Computation information for authors","",,"IEEE Transactions on Evolutionary Computation","29 Jul 2020","2020","24","4","C4","C4","These instructions give guidelines for preparing papers for this publication. Presents information for authors publishing in this journal.","1941-0026","","10.1109/TEVC.2020.3008741","","https://ieeexplore.ieee.org/stamp/stamp.jsp?arnumber=9152182","","","","","","","","","IEEE","29 Jul 2020","","","IEEE","IEEE Journals"
